{
  "release_tag": "v0.17.0",
  "repo": "example-org/example-app-core",
  "run_url": "https://github.com/example-org/agent-ops/actions/runs/00000000102",
  "generated_at": "2026-06-26T02:00:00Z",
  "rubric_version": "0000000000000000000000000000000000000001",
  "market_worthy_min": 6,
  "findings": [
    {
      "pr_number": 1210,
      "pr_title": "S3 store: versioned-object support and multi-region reads",
      "pr_url": "https://github.com/example-org/example-app-core/pull/1210",
      "summary": "example-app now sits in front of your existing S3 bucket and separates compute from storage, so platform teams keep their data plane where it is while adding encrypted vector search.",
      "scores": { "icp_problem_match": 2, "messaging_alignment": 2, "market_resonance": 1, "differentiation_delta": 1, "template_impact": 1 },
      "total": 7,
      "verdict": "market-worthy",
      "evidence": [
        { "source": "02-positioning/claims/tiered-storage-memory-disk-s3.md", "note": "Tiered storage claim: S3 is the tier for cloud-native and multi-region deployments." }
      ]
    },
    {
      "pr_number": 1215,
      "pr_title": "RBAC: per-user keys scoped to read/write",
      "pr_url": "https://github.com/example-org/example-app-core/pull/1215",
      "summary": "The holder of the root index key can mint per-user keys scoped to read and/or write, enforced by the encrypted-index engine on every request. Shipped in v0.17.0.",
      "scores": { "icp_problem_match": 2, "messaging_alignment": 2, "market_resonance": 1, "differentiation_delta": 2, "template_impact": 1 },
      "total": 8,
      "verdict": "market-worthy",
      "evidence": [
        { "source": "01-market-intelligence/ideal-customer-profile.mdx", "note": "ICP audits ask 'who could read this vector?' — per-user key scoping answers it." }
      ]
    }
  ]
}
