{
  "release_tag": "v0.17.0",
  "repo": "example-org/example-app-core",
  "run_url": "https://github.com/example-org/agent-ops/actions/runs/00000000101",
  "generated_at": "2026-06-26T02:00:00Z",
  "rubric_version": "0000000000000000000000000000000000000001",
  "market_worthy_min": 6,
  "findings": [
    {
      "pr_number": 1201,
      "pr_title": "Per-index KMS and cross-account BYOK",
      "pr_url": "https://github.com/example-org/example-app-core/pull/1201",
      "summary": "Each index can now be wrapped by its own operator-managed key, optionally living in the customer's own AWS account via role_arn + external_id. Shipped in v0.17.0. Directly answers the ICP's key-custody requirement: the customer holds the key, <YOUR_COMPANY> never does.",
      "scores": { "icp_problem_match": 2, "messaging_alignment": 2, "market_resonance": 1, "differentiation_delta": 2, "template_impact": 1 },
      "total": 8,
      "verdict": "market-worthy",
      "evidence": [
        { "source": "02-positioning/claims/self-hosted-no-key-custody.md", "note": "Positioning claim: keys live in the customer's KMS; <YOUR_COMPANY> never sees or escrows a customer key." },
        { "source": "01-market-intelligence/ideal-customer-profile.mdx", "note": "ICP must hold their own encryption keys and pass 'who could read this vector?' audits." }
      ]
    },
    {
      "pr_number": 1188,
      "pr_title": "Free tier: make EXAMPLE_APP_API_KEY optional",
      "pr_url": "https://github.com/example-org/example-app-core/pull/1188",
      "summary": "EXAMPLE_APP_API_KEY is now optional; without it example-app runs free-tier with a 1,000,000-item-per-index cap. Removes the procurement step from evaluation, which the ICP names as friction.",
      "scores": { "icp_problem_match": 2, "messaging_alignment": 1, "market_resonance": 1, "differentiation_delta": 1, "template_impact": 2 },
      "total": 7,
      "verdict": "market-worthy",
      "evidence": [
        { "source": "01-market-intelligence/ideal-customer-profile.mdx", "note": "Evaluation friction matters: time-to-first-query under five minutes, no procurement step to evaluate." }
      ]
    },
    {
      "pr_number": 1190,
      "pr_title": "chore: bump pytest to 8.3",
      "pr_url": "https://github.com/example-org/example-app-core/pull/1190",
      "summary": "Dependency bump; no customer-visible change.",
      "scores": { "icp_problem_match": 0, "messaging_alignment": 0, "market_resonance": 0, "differentiation_delta": 0, "template_impact": 0 },
      "total": 0,
      "verdict": "not-market-worthy",
      "evidence": []
    }
  ]
}
